[
    {
        "uniqueId": "4/30/2025 10:16:41",
        "display_date": "June 2",
        "date": "6/2/2025",
        "display_time": "8:00 - 3:30 pm",
        "sessiontime": "8:00:00 AM",
        "datetime": "2025-06-02T12:00:00.000Z",
        "militarytime": "08:00",
        "sessionteacher(s)": "Kara Ripp, Stephanie Hafner, Susan Cook, Chuck D'Andrea, Whitney Weadock",
        "sessiontitle": "Digital Cleanse: Refresh Your iPad & Laptop",
        "zoomLink": "n/a",
        "location": "Beacon",
        "roomnumber": "IDC",
        "sessiondescription": "Out with the clutter, in with the calm! This summer cleanse will help you organize files, declutter apps, and refresh your tech setup—so you can start next year light, bright, and stress-free.",
        "sessioncategory": [
            "Digital Wellness"
        ],
        "bestfor": "All Participants Welcome",
        "save": false
    },
    {
        "uniqueId": "5/7/2025 10:11:28",
        "display_date": "June 2",
        "date": "6/2/2025",
        "display_time": "8:00 - 3:00 pm",
        "sessiontime": "8:00:00 AM",
        "datetime": "2025-06-02T12:00:00.000Z",
        "militarytime": "08:00",
        "sessionteacher(s)": "Kelly Riley, Catherine Kibler, Charles D'Andrea, Tiffany Hutchins",
        "sessiontitle": "Intro to AI for Teachers (Online)",
        "zoomLink": "Canvas link will be emailed to registered participants",
        "location": "Online",
        "roomnumber": "Online",
        "sessiondescription": "In this course, you’ll explore how artificial intelligence can support teaching and learning. You’ll complete two self-paced AI modules from Common Sense Media, along with supplemental activities that will allow you to apply a wide variety of AI tools to your role.\n\nIf you register in PDExpress after May 30, please email kelly_riley@hboe.org and catherine_kibler@hboe.org to be enrolled in the Canvas course. All course work must be completed by Friday, August 8.",
        "sessioncategory": [
            "Lesson Design"
        ],
        "bestfor": "All Participants Welcome",
        "save": false
    },
    {
        "uniqueId": "5/12/2025 10:33:43",
        "display_date": "June 2",
        "date": "6/2/2025",
        "display_time": "8:00 - 11:00 am",
        "sessiontime": "8:00:00 AM",
        "datetime": "2025-06-02T12:00:00.000Z",
        "militarytime": "08:00",
        "sessionteacher(s)": "David Banyots",
        "sessiontitle": "3 Google Sheets to the Wind",
        "zoomLink": "n/a",
        "location": "Davidson",
        "roomnumber": "202",
        "sessiondescription": "Experience a variety of Google Sheets born out of complete necessity, that have saved countless hours of burdensome labor, while bringing joy into the hearts of hundreds, dare I say thousands, of gracious souls. See examples of neat functions and potential applications to solve your problems and spark your imagination. Or come to this session, and spend some time with a Sheets fanatic and things like his Queso Dip Calculator.",
        "sessioncategory": [
            "Assessment & Data"
        ],
        "bestfor": "All Participants Welcome",
        "save": false
    },
    {
        "uniqueId": "5/13/2025 14:47:46",
        "display_date": "June 2 - Aug 8",
        "date": "6/2/2025",
        "display_time": "8:00 - 3:30 pm",
        "sessiontime": "8:00:00 AM",
        "datetime": "2025-06-02T12:00:00.000Z",
        "militarytime": "08:00",
        "sessionteacher(s)": "Kara Ripp, Chuck D'Andrea, Carrie Higginbotham, Stephanie Hafner",
        "sessiontitle": "Everybody Can Grow Summer 2025 Edition",
        "zoomLink": "Canvas link will be emailed to registered participants",
        "location": "Online",
        "roomnumber": "Online",
        "sessiondescription": "Join us for this engaging online professional development course designed specifically for\neducators eager to explore the latest in educational technologies. Everybody Can Grow\nempowers teachers of all levels with practical tools, strategies, and confidence to integrate\ntech into their classrooms effectively. Through interactive sessions, hands-on practice, and\ncollaborative learning, participants will discover how to create dynamic, student-centered\nlearning experiences—because when educators grow, everybody benefits.\nParticipants will receive a Canvas enrollment link once they are signed up in PDexpress. This course is fully online, and self-paced. There are no face-to-face meetings. The course goes live in Canvas on June 2nd and closes on August 8th.",
        "sessioncategory": [
            "Instructional Framework",
            "Personalization",
            "Student Engagement"
        ],
        "bestfor": "All Participants Welcome",
        "save": false
    },
    {
        "uniqueId": "5/15/2025 8:15:27",
        "display_date": "June 2",
        "date": "6/2/2025",
        "display_time": "8:00 - 2:30 pm",
        "sessiontime": "8:00:00 AM",
        "datetime": "2025-06-02T12:00:00.000Z",
        "militarytime": "08:00",
        "sessionteacher(s)": "Ellen Kottenstette",
        "sessiontitle": "HST Science Curriculum Materials Alignment ",
        "zoomLink": "n/a",
        "location": "Station",
        "roomnumber": "34",
        "sessiondescription": "The new curriculum requires an alignment of materials so can get what we need for next year and give to the middle schools what we don't need. ",
        "sessioncategory": [
            "Instructional Framework"
        ],
        "bestfor": "Grades 6-8",
        "save": false
    },
    {
        "uniqueId": "5/15/2025 11:42:25",
        "display_date": "June 2 or June 23",
        "date": "6/2/2025",
        "display_time": "8:00 - 3:00 pm",
        "sessiontime": "8:00:00 AM",
        "datetime": "2025-06-02T12:00:00.000Z",
        "militarytime": "08:00",
        "sessionteacher(s)": "Roseanne Hetterscheidt",
        "sessiontitle": "Engaging and Exploring Activiites in Core Science Classes",
        "zoomLink": "n/a",
        "location": "Davidson",
        "roomnumber": "202",
        "sessiondescription": "Interested teachers are able to join the curriculum team for their given subject area in order to share and compile engaging and exploration-type activities.  These activities will then be imbedded into science units. Core subjects include: Science 6, Science 7, Science 8, Biology, Physical Science, Chemistry, Honors Chemistry and Physics.",
        "sessioncategory": [
            "Student Engagement",
            "Lesson Design"
        ],
        "bestfor": "Grades 6-12",
        "save": false
    },
    {
        "uniqueId": "4/30/2025 14:58:41",
        "display_date": "June 2",
        "date": "6/2/2025",
        "display_time": "9:00 - 3:00 pm",
        "sessiontime": "9:00:00 AM",
        "datetime": "2025-06-02T13:00:00.000Z",
        "militarytime": "09:00",
        "sessionteacher(s)": "Katie Gierach, Katie Winkel",
        "sessiontitle": "Bradley Intervention",
        "zoomLink": "n/a",
        "location": "Bradley",
        "roomnumber": "C111",
        "sessiondescription": "Bradley Intervention Staff will meet to create student schedules that align with student IEP's. Staff will create caseloads for next school year and new student IEP's.",
        "sessioncategory": [
            "Assessment & Data",
            "Student Needs (EL/Gifted/Special Education)"
        ],
        "bestfor": "Bradley Intervention Specialists",
        "save": false
    },
    {
        "uniqueId": "5/7/2025 11:14:43",
        "display_date": "June 2",
        "date": "6/2/2025",
        "display_time": "9:00 - 12:00 pm",
        "sessiontime": "9:00:00 AM",
        "datetime": "2025-06-02T13:00:00.000Z",
        "militarytime": "09:00",
        "sessionteacher(s)": "Jessica Trask-Smith",
        "sessiontitle": "Preschool DEI Year Planning",
        "zoomLink": "n/a",
        "location": "HPS",
        "roomnumber": "301",
        "sessiondescription": "The preschool DEI team will plan for next year's events and goals: Lunch & Learns, Lending Library, Alignment with new preschool curriculum, and Multicultural Fair pre-planning. ",
        "sessioncategory": [
            "Diversity & Equity"
        ],
        "bestfor": "PreK",
        "save": false
    },
    {
        "uniqueId": "4/29/2025 12:30:13",
        "display_date": "June 2",
        "date": "6/2/2025",
        "display_time": "12:00 - 3:00 pm",
        "sessiontime": "12:00:00 PM",
        "datetime": "2025-06-02T16:00:00.000Z",
        "militarytime": "12:00",
        "sessionteacher(s)": "Tiffany Hutchins",
        "sessiontitle": "AI Playground ",
        "zoomLink": "n/a",
        "location": "NOR",
        "roomnumber": "IDC",
        "sessiondescription": "BNLC Staff: Curious about AI in the classroom? Join us in the IDC after packing for guided exploration of various AI tools. Discover how different AI models can tackle teacher \"extras,\" freeing up time for student engagement. Perfect for beginners – let's get comfortable and have some AI fun!",
        "sessioncategory": [
            "Instructional Framework"
        ],
        "bestfor": "Grades PreK-5",
        "save": false
    },
    {
        "uniqueId": "5/9/2025 9:16:00",
        "display_date": "June 2",
        "date": "6/2/2025",
        "display_time": "12:00 - 3:00 pm",
        "sessiontime": "12:00:00 PM",
        "datetime": "2025-06-02T16:00:00.000Z",
        "militarytime": "12:00",
        "sessionteacher(s)": "Ashley Lambacher",
        "sessiontitle": "Organize Your Digital Life",
        "zoomLink": "n/a",
        "location": "Memorial",
        "roomnumber": "Media Center - 142",
        "sessiondescription": "Feeling overwhelmed by digital clutter? Need to clean up your Canvas modules? This session will help you take control of your digital tools—Canvas, Google Docs, Notability, Canva, and more. Learn simple strategies to streamline your files, declutter your dashboards, and create systems that keep you focused and efficient. Work smarter and stay organized all year long!",
        "sessioncategory": [
            "Systems Management (eSchool/Canvas/TAC)"
        ],
        "bestfor": "Grades 6-8",
        "save": false
    },
    {
        "uniqueId": "5/12/2025 11:02:58",
        "display_date": "June 2",
        "date": "6/2/2025",
        "display_time": "12:00 - 3:00 pm",
        "sessiontime": "12:00:00 PM",
        "datetime": "2025-06-02T16:00:00.000Z",
        "militarytime": "12:00",
        "sessionteacher(s)": "David Banyots",
        "sessiontitle": "TipToe Through the MacBooks",
        "zoomLink": "n/a",
        "location": "Davidson",
        "roomnumber": "202",
        "sessiondescription": "Bring your MacBooks for a hands-on deluge of ideas, options, tips, thoughts, and techniques from file and folder management, to dealing with browser tabs, multiple desktops and windows, password management, restarting without losing stuff, keyboard shortcuts, trackpad settings, and so much more!",
        "sessioncategory": [
            "Staff Wellness"
        ],
        "bestfor": "All Participants Welcome",
        "save": false
    },
    {
        "uniqueId": "4/30/2025 10:49:07",
        "display_date": "June 2",
        "date": "6/2/2025",
        "display_time": "1:00 - 3:00 pm",
        "sessiontime": "1:00:00 PM",
        "datetime": "2025-06-02T17:00:00.000Z",
        "militarytime": "13:00",
        "sessionteacher(s)": "Lindsay Noll",
        "sessiontitle": "AI Playground",
        "zoomLink": "n/a",
        "location": "Britton",
        "roomnumber": "IDC",
        "sessiondescription": "Britton Staff- Want to explore how generative AI can lighten your teacher load? Come to the IDC after packing up your room for hands-on fun with various AI tools. Discover beginner-friendly ways to reclaim your time and connect more with students. Let's get comfortable with AI and have some fun!",
        "sessioncategory": [
            "Instructional Framework",
            "Personalization"
        ],
        "bestfor": "Britton Staff K-2",
        "save": false
    },
    {
        "uniqueId": "4/23/2025 8:33:38",
        "display_date": "June 3",
        "date": "6/3/2025",
        "display_time": "8:00 - 3:00 pm",
        "sessiontime": "8:00:00 AM",
        "datetime": "2025-06-03T12:00:00.000Z",
        "militarytime": "08:00",
        "sessionteacher(s)": "Rich Clingman, Terri  Simonetti",
        "sessiontitle": "6th Grade Wellness ",
        "zoomLink": "n/a",
        "location": "Station",
        "roomnumber": "Conference Room",
        "sessiondescription": "Teachers of 6th Grade Wellness Courses will Look at providing new activities based on student survey responses and new expectations for the course.  ",
        "sessioncategory": [
            "Student Well-Being"
        ],
        "bestfor": "6th Grade Wellness in Action",
        "save": false
    },
    {
        "uniqueId": "5/9/2025 11:07:42",
        "display_date": "June 3",
        "date": "6/3/2025",
        "display_time": "8:00 - 2:00 pm ",
        "sessiontime": "8:00:00 AM",
        "datetime": "2025-06-03T12:00:00.000Z",
        "militarytime": "08:00",
        "sessionteacher(s)": "Katie Winkel, Corey Poe, Kristen Welch, Jeff Feathers",
        "sessiontitle": "Career Access and Transition Skills (CATS) Program development ",
        "zoomLink": "n/a",
        "location": "Darby ",
        "roomnumber": "128A",
        "sessiondescription": "The Career Access and Transition Skills (CATS) team will meet to develop transition program and write curriculum for the program starting in fall 2025.",
        "sessioncategory": [
            "Student Needs (EL/Gifted/Special Education)",
            "Lesson Design"
        ],
        "bestfor": "Transition Specialists and  CATS team ",
        "save": false
    },
    {
        "uniqueId": "5/12/2025 16:00:42",
        "display_date": "June 3",
        "date": "6/3/2025",
        "display_time": "8:00 - 2:00 pm",
        "sessiontime": "8:00:00 AM",
        "datetime": "2025-06-03T12:00:00.000Z",
        "militarytime": "08:00",
        "sessionteacher(s)": "Jim Smalley, Kate Kibler, Nikki Hursh",
        "sessiontitle": "Intro to Canva",
        "zoomLink": "n/a",
        "location": "Ridgewood",
        "roomnumber": "IDC",
        "sessiondescription": "Come learn how to get started with your free Canva for Education account. Canva is here for you to create and design amazing projects. In the morning, here's a quick look at what will be covered: \n💻Get logged in with this new account.\n✨ Create Unique Designs: For social media, events, work, and more.\n🖼️ Generate Images: Based on your descriptions.\n⚡️ Brainstorm Ideas: To bring your creative visions to life.\n🧠 Learn New Skills: Detailed info on a wide range of topics. \nYou will have an option of continuing your work in the afternoon to earn a full .6 CEUs",
        "sessioncategory": [
            "Culture / Leadership",
            "Instructional Framework",
            "Personalization",
            "Student Engagement",
            "Student Needs (EL/Gifted/Special Education)",
            "Lesson Design"
        ],
        "bestfor": "All Participants Welcome",
        "save": false
    },
    {
        "uniqueId": "5/13/2025 14:52:31",
        "display_date": "June 3",
        "date": "6/3/2025",
        "display_time": "8:30 - 3:00 pm",
        "sessiontime": "8:00:00 AM",
        "datetime": "2025-06-03T12:00:00.000Z",
        "militarytime": "08:00",
        "sessionteacher(s)": "Introduction to Canvas",
        "sessiontitle": "Canvas 101: A Beginner’s Guide for Educators",
        "zoomLink": "n/a",
        "location": "Beacon",
        "roomnumber": "IDC",
        "sessiondescription": "Whether you're brand new to Canvas or looking to strengthen your foundational skills, this hands-on summer professional development course will equip you with the tools and confidence to create, organize, and manage your digital classroom. In this beginner-friendly workshop, teachers will learn how to navigate the Canvas interface, build course content, communicate effectively with students, and utilize essential features like assignments, modules, discussions, and grading tools.\n\nBy the end of the course, participants will have a fully developed Canvas course ready to launch and the skills needed to continue building engaging, student-centered content throughout the school year. Join us this summer and start the year ahead with a strong foundation in Canvas!",
        "sessioncategory": [
            "Instructional Framework"
        ],
        "bestfor": "All Participants Welcome",
        "save": false
    },
    {
        "uniqueId": "4/25/2025 11:50:25",
        "display_date": "June 3",
        "date": "6/3/2025",
        "display_time": "9:00 - 12:00 pm",
        "sessiontime": "9:00:00 AM",
        "datetime": "2025-06-03T13:00:00.000Z",
        "militarytime": "09:00",
        "sessionteacher(s)": "Tisha Alexander, Dana Schultz",
        "sessiontitle": "Gifted: Canvas Pack Up (Gifted Competencies a,b,c)",
        "zoomLink": "n/a",
        "location": "TBD- participants will be notified",
        "roomnumber": "TBD",
        "sessiondescription": "Use this time to pack-up and put away your Canvas courses for the summer, create new content, and learn about new features for the upcoming school year! Consider coming with your data team to plan/create content together!",
        "sessioncategory": [
            "Systems Management (eSchool/Canvas/TAC)"
        ],
        "bestfor": "Grades 6-8",
        "save": false
    },
    {
        "uniqueId": "4/30/2025 12:55:04",
        "display_date": "June 3",
        "date": "6/3/2025",
        "display_time": "9:00 - 12:00 pm",
        "sessiontime": "9:00:00 AM",
        "datetime": "2025-06-03T13:00:00.000Z",
        "militarytime": "09:00",
        "sessionteacher(s)": " Dr. Atiya Khan, MD, Emma Kamphaus",
        "sessiontitle": "Confidence in the Classroom:  Care of students with Seizure disorders in the classroom and training of emergency administration of nasal medication.",
        "zoomLink": "n/a",
        "location": "Davidson PAC",
        "roomnumber": "76",
        "sessiondescription": "Training that will prepared you to provide seizure care in your classroom and how to administer emergency nasal seizure medication.",
        "sessioncategory": [
            "Nursing Team members  & Open to any staff member that would like seizure care training and medication administration for students in their classroom."
        ],
        "bestfor": "Administrators, All Participants Welcome, Nursing Team members",
        "save": false
    },
    {
        "uniqueId": "5/9/2025 11:24:46",
        "display_date": "June 3 & 4",
        "date": "6/3/2025",
        "display_time": "9:00 - 12:00 pm",
        "sessiontime": "9:00:00 AM",
        "datetime": "2025-06-03T13:00:00.000Z",
        "militarytime": "09:00",
        "sessionteacher(s)": "Sara Barkley",
        "sessiontitle": "Fifth Grade Curriculum Differentiation ",
        "zoomLink": "<a style=\"word-break:break-all;\" data-toggle=\"tooltip\" target=\"_blank\" href=\"https://meet.google.com/rbf-xpxw-gqv\" title=\"https://meet.google.com/rbf-xpxw-gqv\">Video Conference Link</a>",
        "location": "Teams",
        "roomnumber": "Teams",
        "sessiondescription": "This session is recommended for fifth grade teachers at Norwich. We will dig deeper into analyzing the Wit & Wisdom and Illustrative Math curriculums and adapt/differentiate as necessary to fit the needs of every student. We will focus on one curriculum each day.",
        "sessioncategory": [
            "Assessment & Data",
            "Diversity & Equity",
            "Instructional Framework",
            "Student Engagement",
            "Student Needs (EL/Gifted/Special Education)",
            "Systems Management (eSchool/Canvas/TAC)",
            "Lesson Design"
        ],
        "bestfor": "Grades 3-5",
        "save": false
    },
    {
        "uniqueId": "4/29/2025 10:46:32",
        "display_date": "June 4",
        "date": "6/4/2025",
        "display_time": "7:30 - 3:30 pm",
        "sessiontime": "7:30:00 AM",
        "datetime": "2025-06-04T11:30:00.000Z",
        "militarytime": "07:30",
        "sessionteacher(s)": "Mark Pohlman, Rich Boettner",
        "sessiontitle": "LetsGo-OH",
        "zoomLink": "n/a",
        "location": "Memorial",
        "roomnumber": "Multiple Classrooms and Learning Spaces",
        "sessiondescription": " \n\nThe LETSGO-OH Summer Symposium is more than just a conference — it’s a launchpad for innovation. Since 2019, this energizing, free event has brought together forward-thinking educators, tech-savvy coaches, and district teams who are passionate about transforming learning through technology. Designed with collaboration at its core, the symposium offers hands-on sessions, fresh ideas, and real-world strategies you can use right away. Whether you're in the classroom, coaching others, or supporting the tech behind the scenes, you’ll leave inspired, empowered, and ready to lead the charge.",
        "sessioncategory": [
            "Instructional Framework",
            "Personalization",
            "Safety & Prevention",
            "Student Engagement",
            "Student Well-Being",
            "Lesson Design"
        ],
        "bestfor": "All Participants Welcome",
        "save": false
    },
    {
        "uniqueId": "5/12/2025 9:20:31",
        "display_date": "June 4",
        "date": "6/4/2025",
        "display_time": "7:45 - 12:00 pm at OSU Wexner Medical, 1:00 - 2:45 pm at CO",
        "sessiontime": "7:45:00 AM",
        "datetime": "2025-06-04T11:45:00.000Z",
        "militarytime": "07:45",
        "sessionteacher(s)": "Mark Tremayne",
        "sessiontitle": "World of Work Tour - OSU Wexner Medical University Hospital AND Experiential Learning Design",
        "zoomLink": "n/a",
        "location": "Meet in the Lobby of University Hospital, 410 W 10th Ave, Columbus, OH at 7:45 am, ",
        "roomnumber": "Afternoon at CO",
        "sessiondescription": "Join us for a morning of full immersion in the World of Work at OSU University Hospital - 410 W 10th Ave, Columbus, OH 43210. Following the tour and immersive experience, we will meet back at Hilliard City Schools Central Office from 1PM-2:45PM to explore experiential learning opportunities throughout the district. ",
        "sessioncategory": [
            "Student Engagement"
        ],
        "bestfor": "All Participants Welcome",
        "save": false
    },
    {
        "uniqueId": "5/12/2025 16:44:18",
        "display_date": "June 4",
        "date": "6/4/2025",
        "display_time": "8:30 - 11:30 am",
        "sessiontime": "8:30:00 AM",
        "datetime": "2025-06-04T12:30:00.000Z",
        "militarytime": "08:30",
        "sessionteacher(s)": "Adam Sullivan, Angela Griffin",
        "sessiontitle": "ST Math PD Catalog Session for Newcomer Math",
        "zoomLink": "n/a",
        "location": "ILC",
        "roomnumber": "TBD",
        "sessiondescription": "Newcomer Math Team will participate in a PD session from ST Math's PD Catalog for continuation of individualized ST Math Journeys and Incorporation of ST Math Puzzle Talks.",
        "sessioncategory": [
            "Instructional Framework"
        ],
        "bestfor": "Newcomer Math",
        "save": false
    },
    {
        "uniqueId": "5/5/2025 15:15:09",
        "display_date": "June 5",
        "date": "6/5/2025",
        "display_time": "8:00 - 4:00 pm",
        "sessiontime": "8:00:00 AM",
        "datetime": "2025-06-05T12:00:00.000Z",
        "militarytime": "08:00",
        "sessionteacher(s)": "Hilary Sloat, Lila Alsibai",
        "sessiontitle": "Tour of Hilliard",
        "zoomLink": "n/a",
        "location": "The day starts at Noor Islamic Cultural Center",
        "roomnumber": "NA",
        "sessiondescription": "Partnering with community and family members, this professional development experience is designed to deepen teachers' and staff's awareness, understanding, and appreciation of the rich diversity within the Hilliard community. Participants will travel to various locally owned restaurants, grocery stores, places of worship, and community service locations across Hilliard. At each stop, local leaders will share insights into their cultures, experiences, and contributions. Through these personal and immersive experiences, educators will strengthen their ability to connect with and support all families in our schools. \n",
        "sessioncategory": [
            "Culture / Leadership",
            "Diversity & Equity"
        ],
        "bestfor": "All Participants Welcome",
        "save": false
    },
    {
        "uniqueId": "5/6/2025 13:35:38",
        "display_date": "June 5",
        "date": "6/5/2025",
        "display_time": "8:00 - 2:00 pm",
        "sessiontime": "8:00:00 AM",
        "datetime": "2025-06-05T12:00:00.000Z",
        "militarytime": "08:00",
        "sessionteacher(s)": "Rachel Palmer",
        "sessiontitle": "EL Student Schedule Collaboration ",
        "zoomLink": "n/a",
        "location": "Bradley",
        "roomnumber": "A127",
        "sessiondescription": "EL Staff collaboration with school counselors to create individual student schedules for 24-25 school year.",
        "sessioncategory": [
            "Student Needs (EL/Gifted/Special Education)"
        ],
        "bestfor": "EL, Specifically HBR EL staff",
        "save": false
    },
    {
        "uniqueId": "5/9/2025 10:04:42",
        "display_date": "June 5",
        "date": "6/5/2025",
        "display_time": "8:00 - 3:00 pm",
        "sessiontime": "8:00:00 AM",
        "datetime": "2025-06-05T12:00:00.000Z",
        "militarytime": "08:00",
        "sessionteacher(s)": "Ginny Paciorek",
        "sessiontitle": "School Psychologist Summer Academy",
        "zoomLink": "n/a",
        "location": "Memorial",
        "roomnumber": "Media Center",
        "sessiondescription": "This session is for school psychologists only. Participants will cover a range of topics pertaining to school psychology including evaluations and eligibility, MTSS, and mental health services.",
        "sessioncategory": [
            "Student Needs (EL/Gifted/Special Education)"
        ],
        "bestfor": "School Psychologists",
        "save": false
    },
    {
        "uniqueId": "5/12/2025 12:40:46",
        "display_date": "June 5",
        "date": "6/5/2025",
        "display_time": "8:00 - 11:00 am",
        "sessiontime": "8:00:00 AM",
        "datetime": "2025-06-05T12:00:00.000Z",
        "militarytime": "08:00",
        "sessionteacher(s)": "David Banyots",
        "sessiontitle": "Getting Started with Canva",
        "zoomLink": "n/a",
        "location": "Davidson",
        "roomnumber": "202",
        "sessiondescription": "Want to get started with Canva and see what all the hoopla is about? Me too! Bring your laptop, and we’ll get you signed in, explore the Canva environment, and experience a multitude of hands-on activities creating and working with Canva designs!",
        "sessioncategory": [
            "Instructional Framework"
        ],
        "bestfor": "All Participants Welcome",
        "save": false
    },
    {
        "uniqueId": "4/25/2025 11:29:00",
        "display_date": "June 5",
        "date": "6/5/2025",
        "display_time": "9:00 - 12:00 pm",
        "sessiontime": "9:00:00 AM",
        "datetime": "2025-06-05T13:00:00.000Z",
        "militarytime": "09:00",
        "sessionteacher(s)": "Tabatha Stover",
        "sessiontitle": "Thinking Machines: Exploring AI with Elementary Learners",
        "zoomLink": "n/a",
        "location": "Scioto Darby",
        "roomnumber": "Lounge/IDC",
        "sessiondescription": "This introductory lesson is designed to help elementary educators bring the concept of artificial intelligence (AI) into their classrooms in a developmentally appropriate and engaging way. The lesson introduces students to the basics of AI, including what it is, how it works, and how it appears in their everyday lives. It focuses on building awareness of AI’s presence in the world, prompting curiosity, and encouraging thoughtful conversations about technology use and ethics at an early age.",
        "sessioncategory": [
            "AI Integration"
        ],
        "bestfor": "Counselors, EL, Grades PreK-5, Special Education",
        "save": false
    },
    {
        "uniqueId": "4/28/2025 22:20:44",
        "display_date": "June 5",
        "date": "6/5/2025",
        "display_time": "9:00 - 12:00 pm",
        "sessiontime": "9:00:00 AM",
        "datetime": "2025-06-05T13:00:00.000Z",
        "militarytime": "09:00",
        "sessionteacher(s)": "Tiffany Hutchins",
        "sessiontitle": "Digital Tips and Tricks + Google Drive Cleanup",
        "zoomLink": "n/a",
        "location": "NOR",
        "roomnumber": "IDC",
        "sessiondescription": "Your time is VALUABLE! Learn easy computer tips and tricks to reclaim your valuable time, allowing time for more important things in life. Participants will be given time and support to clean up and organize their HSCD Google Drive. ",
        "sessioncategory": [
            "Systems Management (eSchool/Canvas/TAC)"
        ],
        "bestfor": "All Participants Welcome",
        "save": false
    },
    {
        "uniqueId": "4/30/2025 9:50:26",
        "display_date": "June 5",
        "date": "6/5/2025",
        "display_time": "12:30 - 3:30 pm",
        "sessiontime": "12:30:00 PM",
        "datetime": "2025-06-05T16:30:00.000Z",
        "militarytime": "12:30",
        "sessionteacher(s)": "Lindsay Noll, Susan Cook, Carrie Higginbotham",
        "sessiontitle": "Coding the Curriculum: Increasing Student Engagement through Robotics",
        "zoomLink": "n/a",
        "location": "Alton Darby",
        "roomnumber": "IDC",
        "sessiondescription": "This guided play session will give educators supported, hands on time to familiarize themselves with the robotics tools available to K-5 classrooms. Then, collaborate with other classroom and technology educators to explore practical ways to integrate robotics into Wit & Wisdom and Illustrative Math. Bring your district iPad.",
        "sessioncategory": [
            "Student Engagement",
            "Lesson Design"
        ],
        "bestfor": "Grades PreK-5",
        "save": false
    },
    {
        "uniqueId": "5/2/2025 11:42:16",
        "display_date": "June 6",
        "date": "6/6/2025",
        "display_time": "8:00 - 11:00 am",
        "sessiontime": "8:00:00 AM",
        "datetime": "2025-06-06T12:00:00.000Z",
        "militarytime": "08:00",
        "sessionteacher(s)": "Caitlin Bartholic",
        "sessiontitle": "Fine Arts Webpage Design, Learning and Work Session",
        "zoomLink": "n/a",
        "location": "Central Office",
        "roomnumber": "Panther Room  (Mark Sholl put in room request if available)",
        "sessiondescription": "Develop and update your Fine Arts webpage! Learn the most efficient ways to update information, documents, photos, and videos, and how to keep your web page accessible. There will be plenty of facilitated work time to use as you need on your web page.",
        "sessioncategory": [
            "Systems Management (eSchool/Canvas/TAC)"
        ],
        "bestfor": "Grades 6-12 Fine Arts (Art, Music, Theater)",
        "save": false
    },
    {
        "uniqueId": "5/9/2025 22:20:27",
        "display_date": "June 6",
        "date": "6/6/2025",
        "display_time": "8:00 - 11:00 am",
        "sessiontime": "8:00:00 AM",
        "datetime": "2025-06-06T12:00:00.000Z",
        "militarytime": "08:00",
        "sessionteacher(s)": "Elaine Lindenbaum, Eric Gingerich",
        "sessiontitle": "GIFTED: Magic School in the Reading and Writing Process for Social Studies (Gifted Competencies a,b,c,f).",
        "zoomLink": "n/a",
        "location": "MMS ",
        "roomnumber": "Media Center (142)",
        "sessiondescription": "Now that you and your department found all those great readings and primary sources leveled for your various readers, now what?  This workshop will help answer that question by providing an overview of how to employ AI like Magic School and Chat GPT to assist with text leveling.  Next, the workshop will also demonstrate how we can use AI with the HIPPO analysis and writing process.  Finally, and most importantly, we will hear from our colleagues who are currently using various reading and writing strategies like HIPPO, as we collaborate together to better employ reading and writing within our content.",
        "sessioncategory": [
            "Lesson Design"
        ],
        "bestfor": "Grades 6-12",
        "save": false
    },
    {
        "uniqueId": "5/12/2025 10:48:08",
        "display_date": "June 6",
        "date": "6/6/2025",
        "display_time": "9:00 - 11:00 am",
        "sessiontime": "9:00:00 AM",
        "datetime": "2025-06-06T13:00:00.000Z",
        "militarytime": "09:00",
        "sessionteacher(s)": "Nikole Abate",
        "sessiontitle": "ELA State Test Item Analysis & Instructional Implications",
        "zoomLink": "n/a",
        "location": "Memorial",
        "roomnumber": "Media Center",
        "sessiondescription": "In this session, we will engage in item analysis of the 2024-25 ELA state test results and explore the instructional implications of the analysis.",
        "sessioncategory": [
            "Assessment & Data",
            "Instructional Framework"
        ],
        "bestfor": "Grades 6-12",
        "save": false
    },
    {
        "uniqueId": "5/4/2025 12:51:01",
        "display_date": "June 6",
        "date": "6/6/2025",
        "display_time": "12:00 - 3:00 pm",
        "sessiontime": "12:00:00 PM",
        "datetime": "2025-06-06T16:00:00.000Z",
        "militarytime": "12:00",
        "sessionteacher(s)": "Caitlin Bartholic",
        "sessiontitle": "Make it Accessible: Digital Accessibility Basics",
        "zoomLink": "n/a",
        "location": "Central Office",
        "roomnumber": "Panther Room (Mark Sholl put in the room request if available)",
        "sessiondescription": "Make your digital content accessible and inclusive during this facilitated work session. We will discuss the basics of digital accessibility and focus particularly on accessibility features in Canvas, Power Point, and Microsoft Word, including how to make sure any PDFs or presentations you post on Canvas, a website, or e-mail home are accessible for all students and their families.",
        "sessioncategory": [
            "Diversity & Equity"
        ],
        "bestfor": "All Participants Welcome",
        "save": false
    },
    {
        "uniqueId": "5/6/2025 13:47:31",
        "display_date": "June 9",
        "date": "6/9/2025",
        "display_time": "8:00 - 3:00 pm",
        "sessiontime": "8:00:00 AM",
        "datetime": "2025-06-09T12:00:00.000Z",
        "militarytime": "08:00",
        "sessionteacher(s)": "Lauren Barkdull, Nicole Brown",
        "sessiontitle": "MTSS Revival",
        "zoomLink": "n/a",
        "location": "Horizon",
        "roomnumber": "IDC",
        "sessiondescription": "This session is for the MTSS Team at Hilliard Horizon only. The morning will be spent gaining a better understanding the MTSS process and the protocols that will be followed. The afternoon will be spent creating intervention menus for all grade levels.",
        "sessioncategory": [
            "Assessment & Data"
        ],
        "bestfor": "Hilliard Horizon MTSS Members",
        "save": false
    },
    {
        "uniqueId": "5/12/2025 9:07:39",
        "display_date": "June 11",
        "date": "6/11/2025",
        "display_time": "8:00 - 3:00 pm",
        "sessiontime": "8:00:00 AM",
        "datetime": "2025-06-11T12:00:00.000Z",
        "militarytime": "08:00",
        "sessionteacher(s)": "James Desenberg, Jennifer Lowery",
        "sessiontitle": "Gifted: Pearson platform and Alignment with curriculum (Gifted Competencies a, b, c, f, g)",
        "zoomLink": "n/a",
        "location": "Darby",
        "roomnumber": "116",
        "sessiondescription": "Discover how to navigate the Pearson platform for Algebra 3, PreCalculus and Calculus courses. Learn the essential skills for creating and configuring various assignments such as homework, quizzes and tests, while ensuring these materials properly align with your specific course curriculum.",
        "sessioncategory": [
            "Assessment & Data",
            "Lesson Design"
        ],
        "bestfor": "Grades 9-12",
        "save": false
    },
    {
        "uniqueId": "5/12/2025 15:57:57",
        "display_date": "June 12",
        "date": "6/12/2025",
        "display_time": "8:00 - 3:00 pm",
        "sessiontime": "8:00:00 AM",
        "datetime": "2025-06-12T12:00:00.000Z",
        "militarytime": "08:00",
        "sessionteacher(s)": "Chuck D'Andrea, Jim Smalley, Katie Kibler, Nikki Hursh",
        "sessiontitle": "Intro to Canva",
        "zoomLink": "n/a",
        "location": "Ridgewood",
        "roomnumber": "IDC",
        "sessiondescription": "Come learn how to get started with your free Canva for Education account. Canva is here for you to create and design amazing projects. In the morning, here's a quick look at what will be covered: \n💻Get logged in with this new account.\n✨ Create Unique Designs: For social media, events, work, and more.\n🖼️ Generate Images: Based on your descriptions.\n⚡️ Brainstorm Ideas: To bring your creative visions to life.\n🧠 Learn New Skills: Detailed info on a wide range of topics. \nYou will have an option of continuing your work in the afternoon to earn a full .6 CEUs",
        "sessioncategory": [
            "Personalization",
            "Student Engagement",
            "Student Well-Being",
            "Lesson Design"
        ],
        "bestfor": "All Participants Welcome",
        "save": false
    },
    {
        "uniqueId": "5/7/2025 12:50:55",
        "display_date": "June 12",
        "date": "6/12/2025",
        "display_time": "9:00 - 3:00 pm",
        "sessiontime": "9:00:00 AM",
        "datetime": "2025-06-12T13:00:00.000Z",
        "militarytime": "09:00",
        "sessionteacher(s)": "Matthew Sparks",
        "sessiontitle": "Beacon Retreat ",
        "zoomLink": "n/a",
        "location": "Battelle Darby Creek Cedar Ridge",
        "roomnumber": "n/a",
        "sessiondescription": "Beacon retreat working on building commitment plan goals ",
        "sessioncategory": [
            "Staff Wellness",
            "Student Well-Being"
        ],
        "bestfor": "Beacon Staff ",
        "save": false
    },
    {
        "uniqueId": "5/8/2025 17:45:27",
        "display_date": "June 12",
        "date": "6/12/2025",
        "display_time": "9:00 - 12:00 pm",
        "sessiontime": "9:00:00 AM",
        "datetime": "2025-06-12T13:00:00.000Z",
        "militarytime": "09:00",
        "sessionteacher(s)": "Niki Brown",
        "sessiontitle": "Fact Fluency Refresher",
        "zoomLink": "n/a",
        "location": "Horizon ",
        "roomnumber": "IDC",
        "sessiondescription": "Horizon teachers only. Come learn about why fact fluency is so important to success in math. We will have a special focus on how number sense in the early grades impacts the ability to retain facts as students get older. We will share procedures that have worked and will problem solve about areas of struggle in our fact fluency block.",
        "sessioncategory": [
            "Instructional Framework",
            "Personalization"
        ],
        "bestfor": "Horizon Teachers K-5",
        "save": false
    },
    {
        "uniqueId": "5/15/2025 13:49:36",
        "display_date": "June 12",
        "date": "6/12/2025",
        "display_time": "9:00 - 12:00 pm",
        "sessiontime": "9:00:00 AM",
        "datetime": "2025-06-12T13:00:00.000Z",
        "militarytime": "09:00",
        "sessionteacher(s)": "Mark Sholl",
        "sessiontitle": "Digital and Media Arts Alignment",
        "zoomLink": "n/a",
        "location": "Central Office",
        "roomnumber": "Panther Room",
        "sessiondescription": "This session is designed to lay the initial foundation for developing a class to bridge what is learned in 6th grade digital art classes, and what is needed to be successful in high school Media Arts Adobe Credentialing classes.",
        "sessioncategory": [
            "Assessment & Data",
            "Instructional Framework"
        ],
        "bestfor": "Secondary Art Teachers",
        "save": false
    },
    {
        "uniqueId": "5/8/2025 17:50:38",
        "display_date": "June 12",
        "date": "6/12/2025",
        "display_time": "1:00 - 3:00 pm",
        "sessiontime": "1:00:00 AM",
        "datetime": "2025-06-12T17:00:00.000Z",
        "militarytime": "13:00",
        "sessionteacher(s)": "Niki Brown",
        "sessiontitle": "Intervention Block Match Up",
        "zoomLink": "n/a",
        "location": "HZN",
        "roomnumber": "IDC",
        "sessiondescription": "Horizon Teachers only. Come learn how to best support your learners during intervention block. We will look at how to use Acadience, STAR Reading and STAR Math to intervene to build skill in students. We will share organizational tips and problem solve our struggles during this session.",
        "sessioncategory": [
            "Instructional Framework",
            "Personalization"
        ],
        "bestfor": "Horizon teachers only K-5",
        "save": false
    },
    {
        "uniqueId": "5/13/2025 18:24:41",
        "display_date": "June 13 & Aug 11 ",
        "date": "6/13/2025",
        "display_time": "8:00 - 11:00 am",
        "sessiontime": "8:00:00 AM",
        "datetime": "2025-06-13T12:00:00.000Z",
        "militarytime": "08:00",
        "sessionteacher(s)": "Whitney Weadock, Chuck D'Andrea, Jim Smalley ",
        "sessiontitle": "Organize your stuff",
        "zoomLink": "n/a",
        "location": "Darby Creek ",
        "roomnumber": "IDC/library ",
        "sessiondescription": "Come organize google, Apple, and canvas. We will help you organize all you electronics to keep your life simple. There will be a lot of work time here. Please bring device. ",
        "sessioncategory": [
            "Instructional Framework",
            "Staff Wellness",
            "Systems Management (eSchool/Canvas/TAC)"
        ],
        "bestfor": "All Participants Welcome",
        "save": false
    },
    {
        "uniqueId": "5/15/2025 14:04:02",
        "display_date": "June 13",
        "date": "6/13/2025",
        "display_time": "8:30 - 11:30 am",
        "sessiontime": "8:30:00 AM",
        "datetime": "2025-06-13T12:30:00.000Z",
        "militarytime": "08:30",
        "sessionteacher(s)": "Mark Sholl",
        "sessiontitle": "Middle Level Music Curricular Check In",
        "zoomLink": "n/a",
        "location": "Central Office",
        "roomnumber": "Panther Room",
        "sessiondescription": "This session will ask participants to share innovative ideas they are using in their music classes with a focus primarily on middle level courses. This will also explore class level names.",
        "sessioncategory": [
            "Assessment & Data",
            "Instructional Framework"
        ],
        "bestfor": "Secondary Music Teachers",
        "save": false
    },
    {
        "uniqueId": "5/7/2025 9:56:38",
        "display_date": "June 16",
        "date": "6/16/2025",
        "display_time": "8:00 - 3:00 pm",
        "sessiontime": "8:00:00 AM",
        "datetime": "2025-06-16T12:00:00.000Z",
        "militarytime": "08:00",
        "sessionteacher(s)": "Kelly Riley, Catherine Kibler",
        "sessiontitle": "Intro to AI for Teachers (In-person)",
        "zoomLink": "n/a",
        "location": "WSH",
        "roomnumber": "IDC",
        "sessiondescription": "In this course, you’ll explore how artificial intelligence can support teaching and learning. You’ll complete two self-paced AI modules from Common Sense Media, along with supplemental activities that will allow you to apply a wide variety of AI tools to your role.\n\nPlease bring your laptop and iPad. All course materials will be provided via Canvas.",
        "sessioncategory": [
            "Lesson Design"
        ],
        "bestfor": "All Participants Welcome",
        "save": false
    },
    {
        "uniqueId": "5/8/2025 9:15:05",
        "display_date": "June 17",
        "date": "6/17/2025",
        "display_time": "8:00 - 2:00 pm",
        "sessiontime": "8:00:00 AM",
        "datetime": "2025-06-17T12:00:00.000Z",
        "militarytime": "08:00",
        "sessionteacher(s)": "Joan Pitstick",
        "sessiontitle": "6th Grade Social Studies Data Dig/Assessment Creation",
        "zoomLink": "n/a",
        "location": "Darby",
        "roomnumber": "Room 102",
        "sessiondescription": "Station teachers will meet to go over data from assessments.  New assessments and plans will be made for next year according to the data.",
        "sessioncategory": [
            "Assessment & Data"
        ],
        "bestfor": "Grades 6-8",
        "save": false
    },
    {
        "uniqueId": "5/15/2025 12:16:52",
        "display_date": "June 17",
        "date": "6/17/2025",
        "display_time": "8:00 am ",
        "sessiontime": "8:00:00 AM",
        "datetime": "2025-06-17T12:00:00.000Z",
        "militarytime": "08:00",
        "sessionteacher(s)": "Roseanne Hetterscheidt",
        "sessiontitle": " Gifted:  Ambitious Science Teaching Book Study with Applications to the Classroom (competencies a, b, c)",
        "zoomLink": "<a style=\"word-break:break-all;\" data-toggle=\"tooltip\" target=\"_blank\" href=\"https://teams.microsoft.com/dl/launcher/launcher.html?url=%2F_%23%2Fl%2Fmeetup-join%2F19%3Ameeting_MThjYjQ4YWQtZjM2ZS00NWY3LWI5NjAtNWNkOTVjODc4OGIy%40thread.v2%2F0%3Fcontext%3D%257b%2522Tid%2522%253a%2522db54f087-8ef5-4cad-bdd7-59d079e4f03b%2522%252c%2522Oid%2522%253a%252202e2f029-741f-4943-8461-4bd25e01930a%2522%257d%26anon%3Dtrue&type=meetup-join&deeplinkId=72ba4032-0a9a-4e25-8b77-ae8d9866c55d&directDl=true&msLaunch=true&enableMobilePage=true&suppressPrompt=true\" title=\"https://teams.microsoft.com/dl/launcher/launcher.html?url=%2F_%23%2Fl%2Fmeetup-join%2F19%3Ameeting_MThjYjQ4YWQtZjM2ZS00NWY3LWI5NjAtNWNkOTVjODc4OGIy%40thread.v2%2F0%3Fcontext%3D%257b%2522Tid%2522%253a%2522db54f087-8ef5-4cad-bdd7-59d079e4f03b%2522%252c%2522Oid%2522%253a%252202e2f029-741f-4943-8461-4bd25e01930a%2522%257d%26anon%3Dtrue&type=meetup-join&deeplinkId=72ba4032-0a9a-4e25-8b77-ae8d9866c55d&directDl=true&msLaunch=true&enableMobilePage=true&suppressPrompt=true\">Video Conference Link</a>",
        "location": "Virtual",
        "roomnumber": "none needed",
        "sessiondescription": "Teachers will read \"Ambitious Science Teaching\" and use the information in the book to design or redesign classroom activities/units.  Teachers will meet virtually 3 times and will earn 6 gifted ours.  Reading and some work will need to be done before the June 17 meeting.  Several copies of this book are around the district for you to borrow if you don't want to buy it.",
        "sessioncategory": [
            "Student Needs (EL/Gifted/Special Education)",
            "Lesson Design"
        ],
        "bestfor": "Grades 6-12",
        "save": false
    },
    {
        "uniqueId": "5/11/2025 22:28:25",
        "display_date": "June 17 & 28",
        "date": "6/17/2025",
        "display_time": "9:00 - 12:00 pm",
        "sessiontime": "9:00:00 AM",
        "datetime": "2025-06-17T13:00:00.000Z",
        "militarytime": "09:00",
        "sessionteacher(s)": "Hilary Sloat, Tiffany Thomas",
        "sessiontitle": "Book Talk: The Other Americans",
        "zoomLink": "Zoom Meeting ID: 266 808 233 871 8 Passcode: Zc3h4Re2",
        "location": "online",
        "roomnumber": "NA",
        "sessiondescription": "Our Summer Book Talk is back led by Tiffany Thomas, Noor Alghussain, and Hilary Sloat. The Other Americans is a work of fiction that explores the themes of immigration, community, and identity. In addition to reading the book, we will be watching short videos and discussing current events to complement the conversation. The Other Americans is a highly engaging book and people who join the session will get a copy of the book to read. ",
        "sessioncategory": [
            "Culture / Leadership",
            "Diversity & Equity",
            "Student Needs (EL/Gifted/Special Education)"
        ],
        "bestfor": "All Participants Welcome",
        "save": false
    },
    {
        "uniqueId": "5/9/2025 14:48:22",
        "display_date": "June 26",
        "date": "6/26/2025",
        "display_time": "9:00 - 12:00 pm (participants will need 3 hours prior to our in-person session to read the book and complete the companion workbook)",
        "sessiontime": "9:00:00 AM",
        "datetime": "2025-06-26T13:00:00.000Z",
        "militarytime": "09:00",
        "sessionteacher(s)": "Ami Papadopulo",
        "sessiontitle": "Running the Distance  by Jared S. Blank (book study with companion workbook, both downloadable)",
        "zoomLink": "n/a",
        "location": "Darby",
        "roomnumber": "Supported Studies ",
        "sessiondescription": "A book study about how the author's learning challenges, specifically dyslexia, prepared him for the World Marathon Challenge and life. The book and the companion workbook are downloadable. From the book: \"The next eighteen years of your life will be like running with a cut on your foot\" my doctor told me.",
        "sessioncategory": [
            "Student Needs (EL/Gifted/Special Education)"
        ],
        "bestfor": "All Participants Welcome",
        "save": false
    },
    {
        "uniqueId": "5/13/2025 13:22:20",
        "display_date": "June 30 & July 28",
        "date": "6/30/2025",
        "display_time": "10:30 - 12:00 pm",
        "sessiontime": "10:30:00 AM",
        "datetime": "2025-06-30T14:30:00.000Z",
        "militarytime": "10:30",
        "sessionteacher(s)": "Emily Dixon, Maureen Flanagan, AJ Schultz",
        "sessiontitle": "Secondary EL Summer Book Club",
        "zoomLink": "<a style=\"word-break:break-all;\" data-toggle=\"tooltip\" target=\"_blank\" href=\"https://teams.microsoft.com/l/meetup-join/19%3ameeting_MGEwNzRiZWQtMzdjNi00YjU3LWIzYTItYTU2YjliZmQxMmFl%40thread.v2/0?context=%7b%22Tid%22%3a%22db54f087-8ef5-4cad-bdd7-59d079e4f03b%22%2c%22Oid%22%3a%22599ecf23-357b-4151-b4a3-95b69c512be2%22%7d\" title=\"https://teams.microsoft.com/l/meetup-join/19%3ameeting_MGEwNzRiZWQtMzdjNi00YjU3LWIzYTItYTU2YjliZmQxMmFl%40thread.v2/0?context=%7b%22Tid%22%3a%22db54f087-8ef5-4cad-bdd7-59d079e4f03b%22%2c%22Oid%22%3a%22599ecf23-357b-4151-b4a3-95b69c512be2%22%7d\">Video Conference Link</a>",
        "location": "TEAMS",
        "roomnumber": "NA",
        "sessiondescription": "Secondary EL staff will read three YA books that will give us the opportunity to discuss issues relevant to our students. The staff will read the books on their own and then meet virtually to discuss. A collection of several titles have been suggested for reading and staff members can choose which three books they would like to read independently to discuss on meeting dates",
        "sessioncategory": [
            "Diversity & Equity",
            "Personalization",
            "Student Engagement",
            "Student Needs (EL/Gifted/Special Education)"
        ],
        "bestfor": "EL",
        "save": false
    },
    {
        "uniqueId": "5/12/2025 15:10:11",
        "display_date": "July 31",
        "date": "7/31/2025",
        "display_time": "8:00 - 2:00 pm",
        "sessiontime": "8:00:00 AM",
        "datetime": "2025-07-31T12:00:00.000Z",
        "militarytime": "08:00",
        "sessionteacher(s)": "Scott Snyder",
        "sessiontitle": "Tharp Staff Retreat",
        "zoomLink": "n/a",
        "location": "Little Grand Meeting Room",
        "roomnumber": "710 Grandview Crossing Way",
        "sessiondescription": "Introduction of District Commitment Plan ...Collaboration & Team Building",
        "sessioncategory": [
            "Assessment & Data",
            "Culture / Leadership",
            "Diversity & Equity",
            "Instructional Framework",
            "Staff Wellness",
            "Student Engagement",
            "Student Well-Being",
            "Lesson Design"
        ],
        "bestfor": "Tharp Staff",
        "save": false
    },
    {
        "uniqueId": "5/12/2025 9:40:38",
        "display_date": "Aug 1",
        "date": "8/1/2025",
        "display_time": "8:00 - 2:00 pm",
        "sessiontime": "8:00:00 AM",
        "datetime": "2025-08-01T12:00:00.000Z",
        "militarytime": "08:00",
        "sessionteacher(s)": "Erin Dooley, Matt Trombitas",
        "sessiontitle": "Station Staff Retreat",
        "zoomLink": "n/a",
        "location": "TBD",
        "roomnumber": "TBD",
        "sessiondescription": "Time for some Cougar Connection and prep for 25-26!  ",
        "sessioncategory": [
            "Assessment & Data",
            "Culture / Leadership",
            "Instructional Framework",
            "Personalization",
            "Staff Wellness",
            "Student Engagement",
            "Student Needs (EL/Gifted/Special Education)"
        ],
        "bestfor": "Station Staff",
        "save": false
    },
    {
        "uniqueId": "5/13/2025 12:32:24",
        "display_date": "Aug 1",
        "date": "8/1/2025",
        "display_time": "9:00 - 3:00 pm",
        "sessiontime": "9:00:00 AM",
        "datetime": "2025-08-01T13:00:00.000Z",
        "militarytime": "09:00",
        "sessionteacher(s)": "Tiffany Thomas, Nikki Henkel",
        "sessiontitle": "Methods to Maximize Research, Student Growth and Teacher Support in our Media Centers",
        "zoomLink": "n/a",
        "location": "Darby ",
        "roomnumber": "Media Center",
        "sessiondescription": "This session will introduce media specialists, in particular secondary level, to methods and approaches to provide support in research and student growth as well as ways to help teachers inside and outside the classroom. Time will be given to collaborate. ",
        "sessioncategory": [
            "Instructional Framework"
        ],
        "bestfor": "Media Specialists (Secondary)",
        "save": false
    },
    {
        "uniqueId": "5/1/2025 14:18:31",
        "display_date": "Aug 4",
        "date": "8/4/2025",
        "display_time": "8:00 - 11:00 am",
        "sessiontime": "8:00:00 AM",
        "datetime": "2025-08-04T12:00:00.000Z",
        "militarytime": "08:00",
        "sessionteacher(s)": "Rita Kitchen, Maria Stead",
        "sessiontitle": "AI Speed-Dating: Find Your Perfect (Tech) Match",
        "zoomLink": "n/a",
        "location": "Darby",
        "roomnumber": "Media Center",
        "sessiondescription": "Curious about AI tools? Come speed-date a range of new and familiar options to simplify teaching and energize learning. From task automation to creative experiences, you'll explore tools, spark ideas, and maybe even fall in (edtech) love.",
        "sessioncategory": [
            "Student Engagement",
            "Lesson Design"
        ],
        "bestfor": "Grades 6-12",
        "save": false
    },
    {
        "uniqueId": "5/13/2025 18:32:10",
        "display_date": "Aug 4",
        "date": "8/4/2025",
        "display_time": "8:00 - 2:00 pm ",
        "sessiontime": "8:00:00 AM",
        "datetime": "2025-08-04T12:00:00.000Z",
        "militarytime": "08:00",
        "sessionteacher(s)": "Whitney weadock, Jim Smalley, Nikki Hursh ",
        "sessiontitle": "3D printing in the elementary classroom",
        "zoomLink": "n/a",
        "location": "Crossing ",
        "roomnumber": "IDC",
        "sessiondescription": "Come learn about 3d printing. You will be able to have time to explore the Tinkercad app and plan lessons you can incorporate in your classroom. All schools have a 3D printer your ids can help you with. ",
        "sessioncategory": [
            "Personalization",
            "Student Engagement",
            "Lesson Design"
        ],
        "bestfor": "Grades PreK-5",
        "save": false
    },
    {
        "uniqueId": "5/2/2025 12:35:03",
        "display_date": "Aug 5",
        "date": "8/5/2025",
        "display_time": "8:00 - 11:00 am",
        "sessiontime": "8:00:00 AM",
        "datetime": "2025-08-05T12:00:00.000Z",
        "militarytime": "08:00",
        "sessionteacher(s)": "David Banyots, Rita Kitchen",
        "sessiontitle": "Gifted: Canvas Unpack (Gifted Competencies a,b,c)",
        "zoomLink": "n/a",
        "location": "Davidson",
        "roomnumber": "Media Center",
        "sessiondescription": "Use this time to unpack your Canvas courses, import content from last year, create new content, and learn about new features for the upcoming school year! Consider coming with your data team to plan/create content together!",
        "sessioncategory": [
            "Systems Management (eSchool/Canvas/TAC)"
        ],
        "bestfor": "Grades 6-12",
        "save": false
    },
    {
        "uniqueId": "5/8/2025 9:17:55",
        "display_date": "Aug 5",
        "date": "8/5/2025",
        "display_time": "8:00 - 2:00 pm",
        "sessiontime": "8:00:00 AM",
        "datetime": "2025-08-05T12:00:00.000Z",
        "militarytime": "08:00",
        "sessionteacher(s)": "Joan Pitstick",
        "sessiontitle": "6th Grade Social Studies Data Dig/Assessment Creation",
        "zoomLink": "n/a",
        "location": "Darby",
        "roomnumber": "102",
        "sessiondescription": "Station teachers will meet to go over data from assessments. New assessments and plans will be made for next year according to the data.",
        "sessioncategory": [
            "Assessment & Data"
        ],
        "bestfor": "Grades 6-8",
        "save": false
    },
    {
        "uniqueId": "5/12/2025 15:00:04",
        "display_date": "Aug 5",
        "date": "8/5/2025",
        "display_time": "8:00 - 2:30 pm",
        "sessiontime": "8:00:00 AM",
        "datetime": "2025-08-05T12:00:00.000Z",
        "militarytime": "08:00",
        "sessionteacher(s)": "Craig Vroom",
        "sessiontitle": "Online Academy Staff Retreat",
        "zoomLink": "n/a",
        "location": "ILC",
        "roomnumber": "000",
        "sessiondescription": "The Online Academy will hold its annual staff retreat on Tuesday, August 5th at the ILC.",
        "sessioncategory": [
            "Culture / Leadership",
            "Instructional Framework",
            "Staff Wellness"
        ],
        "bestfor": "All Participants Welcome",
        "save": false
    },
    {
        "uniqueId": "5/1/2025 14:35:30",
        "display_date": "Aug 5",
        "date": "8/5/2025",
        "display_time": "12:00 - 3:00 pm",
        "sessiontime": "12:00:00 PM",
        "datetime": "2025-08-05T16:00:00.000Z",
        "militarytime": "12:00",
        "sessionteacher(s)": "Rita Kitchen, Maria Stead",
        "sessiontitle": "AI Speed-Dating: Find Your Perfect (Tech) Match",
        "zoomLink": "n/a",
        "location": "Davidson",
        "roomnumber": "Media Center",
        "sessiondescription": "Curious about AI tools? Come speed-date a range of new and familiar options to simplify teaching and energize learning. From task automation to creative experiences, you'll explore tools, spark ideas, and maybe even fall in (edtech) love.",
        "sessioncategory": [
            "Student Engagement",
            "Lesson Design"
        ],
        "bestfor": "Grades 6-12",
        "save": false
    },
    {
        "uniqueId": "5/9/2025 22:25:03",
        "display_date": "Aug 5",
        "date": "8/5/2025",
        "display_time": "12:00 - 3:00 pm",
        "sessiontime": "12:00:00 PM",
        "datetime": "2025-08-05T16:00:00.000Z",
        "militarytime": "12:00",
        "sessionteacher(s)": "Elaine Lindenbaum, Eric Gingerich",
        "sessiontitle": "GIFTED: Magic School in the Reading and Writing Process for Social Studies (Gifted Competencies a,b,c,f).",
        "zoomLink": "n/a",
        "location": "HUB",
        "roomnumber": "Union (90)",
        "sessiondescription": "Now that you and your department found all those great readings and primary sources leveled for your various readers, now what? This workshop will help answer that question by providing an overview of how to employ AI like Magic School and Chat GPT to assist with text leveling. Next, the workshop will also demonstrate how we can use AI with the HIPPO analysis and writing process. Finally, and most importantly, we will hear from our colleagues who are currently using various reading and writing strategies like HIPPO, as we collaborate together to better employ reading and writing within our content.",
        "sessioncategory": [
            "Lesson Design"
        ],
        "bestfor": "Grades 6-12",
        "save": false
    },
    {
        "uniqueId": "5/12/2025 13:20:31",
        "display_date": "Aug 5",
        "date": "8/5/2025",
        "display_time": "12:00 - 3:00 pm",
        "sessiontime": "12:00:00 PM",
        "datetime": "2025-08-05T16:00:00.000Z",
        "militarytime": "12:00",
        "sessionteacher(s)": "David Banyots",
        "sessiontitle": "TipToe Through the MacBooks",
        "zoomLink": "n/a",
        "location": "Davidson",
        "roomnumber": "202",
        "sessiondescription": "Bring your MacBooks for a hands-on deluge of ideas, options, tips, thoughts, and techniques from file and folder management, to dealing with browser tabs, multiple desktops and windows, password management, restarting without losing stuff, keyboard shortcuts, trackpad settings, and so much more!",
        "sessioncategory": [
            "Staff Wellness"
        ],
        "bestfor": "All Participants Welcome",
        "save": false
    },
    {
        "uniqueId": "5/9/2025 9:24:43",
        "display_date": "Aug 6",
        "date": "8/6/2025",
        "display_time": "8:00 - 12:00 pm",
        "sessiontime": "8:00:00 AM",
        "datetime": "2025-08-06T12:00:00.000Z",
        "militarytime": "08:00",
        "sessionteacher(s)": "Elaine Lindenbaum, Ashley Lambacher",
        "sessiontitle": "Gifted: Magic School and Writing with Core Disciplines (Gifted Competencies A and B)",
        "zoomLink": "n/a",
        "location": "Memorial",
        "roomnumber": "Media Center - 142",
        "sessiondescription": "Discover how MagicSchool AI can supercharge teaching and learning in your core content classes! In this interactive session, we’ll explore practical, discipline-specific ways teachers and students can leverage MagicSchool to save time, differentiate instruction, and spark engagement. Learn how to generate leveled texts, create scaffolded writing supports, design standards-aligned questions, and even empower students to ethically and creatively use AI in their own work. Walk away with ready-to-use strategies and confidence to bring AI into your daily practice — no prior AI experience needed!  The class is for all, not just for those seeking gifted hours",
        "sessioncategory": [
            "Lesson Design"
        ],
        "bestfor": "Grades 6-12",
        "save": false
    },
    {
        "uniqueId": "5/12/2025 16:02:56",
        "display_date": "Aug 6",
        "date": "8/6/2025",
        "display_time": "8:00 - 2:00 pm",
        "sessiontime": "8:00:00 AM",
        "datetime": "2025-08-06T12:00:00.000Z",
        "militarytime": "08:00",
        "sessionteacher(s)": "Jim Smalley, Charles D'Andrea, Katie Kibler, Nikki Hursh",
        "sessiontitle": "Intro to Canva",
        "zoomLink": "n/a",
        "location": "Hilliard Crossing",
        "roomnumber": "IDC",
        "sessiondescription": "Come learn how to get started with your free Canva for Education account. Canva is here for you to create and design amazing projects. In the morning, here's a quick look at what will be covered: \n💻Get logged in with this new account.\n✨ Create Unique Designs: For social media, events, work, and more.\n🖼️ Generate Images: Based on your descriptions.\n⚡️ Brainstorm Ideas: To bring your creative visions to life.\n🧠 Learn New Skills: Detailed info on a wide range of topics. \nYou will have an option of continuing your work in the afternoon to earn a full .6 CEUs",
        "sessioncategory": [
            "Culture / Leadership",
            "Instructional Framework",
            "Personalization",
            "Student Engagement",
            "Student Well-Being",
            "Lesson Design"
        ],
        "bestfor": "All Participants Welcome",
        "save": false
    },
    {
        "uniqueId": "4/29/2025 12:04:47",
        "display_date": "Aug 6",
        "date": "8/6/2025",
        "display_time": "9:00 - 12:00 pm",
        "sessiontime": "9:00:00 AM",
        "datetime": "2025-08-06T13:00:00.000Z",
        "militarytime": "09:00",
        "sessionteacher(s)": "Tiffany Hutchins, Kelly Riley, Whitney Weadock",
        "sessiontitle": "iPad Possibilities",
        "zoomLink": "n/a",
        "location": "NOR",
        "roomnumber": "30",
        "sessiondescription": "Empower your classroom with creative iPad tools! This session explores engaging Apple features and apps to boost student creativity and collaboration across subjects. Discover practical strategies and hands-on techniques to transform teaching and inspire digital expression. Leave with actionable ideas!",
        "sessioncategory": [
            "Student Engagement"
        ],
        "bestfor": "PreK-2, Grades 3-5",
        "save": false
    },
    {
        "uniqueId": "5/5/2025 14:32:20",
        "display_date": "Aug 6",
        "date": "8/6/2025",
        "display_time": "12:00 - 3:00 pm",
        "sessiontime": "12:00:00 PM",
        "datetime": "2025-08-06T16:00:00.000Z",
        "militarytime": "12:00",
        "sessionteacher(s)": "Tiffany Hutchins, Lindsay Noll",
        "sessiontitle": "Creating Community Digitally ",
        "zoomLink": "n/a",
        "location": "Norwich ",
        "roomnumber": "IDC",
        "sessiondescription": "Explore practical ways to leverage digital tools and resources to strengthen classroom community, foster connection, and enhance student engagement.",
        "sessioncategory": [
            "Culture / Leadership"
        ],
        "bestfor": "Grades PreK-5",
        "save": false
    },
    {
        "uniqueId": "5/12/2025 13:32:29",
        "display_date": "Aug 6",
        "date": "8/6/2025",
        "display_time": "12:00 - 3:00 pm",
        "sessiontime": "12:00:00 PM",
        "datetime": "2025-08-06T16:00:00.000Z",
        "militarytime": "12:00",
        "sessionteacher(s)": "David Banyots, Kaitlyn Hall",
        "sessiontitle": "Gifted: Canva Coalescence (Gifted Competencies a,b)",
        "zoomLink": "n/a",
        "location": "Davidson",
        "roomnumber": "202",
        "sessiondescription": "Looking to dive into Canva and see what it can do? Join us as we get you signed in and introduced to Canva, get you hands-on with creating designs, and show you classroom proven examples and ideas that you can start using this fall! ",
        "sessioncategory": [
            "Instructional Framework"
        ],
        "bestfor": "Grades 6-12",
        "save": false
    },
    {
        "uniqueId": "5/12/2025 11:51:11",
        "display_date": "Aug 7",
        "date": "8/7/2025",
        "display_time": "8:00 - 3:00 pm",
        "sessiontime": "8:00:00 AM",
        "datetime": "2025-08-07T12:00:00.000Z",
        "militarytime": "08:00",
        "sessionteacher(s)": "Stacy Carter, Craig Vroom",
        "sessiontitle": "Innovation Campus Leadership Team Retreat",
        "zoomLink": "n/a",
        "location": "The Hub",
        "roomnumber": "Union",
        "sessiondescription": "This is the retreat for the Innovation Campus Leadership Team",
        "sessioncategory": [
            "Culture / Leadership"
        ],
        "bestfor": "Innovation Campus Leadership Team",
        "save": false
    },
    {
        "uniqueId": "5/12/2025 13:36:59",
        "display_date": "Aug 7",
        "date": "8/7/2025",
        "display_time": "8:00 - 11:00 am",
        "sessiontime": "8:00:00 AM",
        "datetime": "2025-08-07T12:00:00.000Z",
        "militarytime": "08:00",
        "sessionteacher(s)": "David Banyots",
        "sessiontitle": "3 Google Sheets to the Wind",
        "zoomLink": "n/a",
        "location": "Davidson",
        "roomnumber": "202",
        "sessiondescription": "Experience a variety of Google Sheets born out of complete necessity, that have saved countless hours of burdensome labor, while bringing joy into the hearts of hundreds, dare I say thousands, of gracious souls. See examples of neat functions and potential applications to solve your problems and spark your imagination. Or come to this session, and spend some time with a Sheets fanatic and things like his Queso Dip Calculator.",
        "sessioncategory": [
            "Assessment & Data"
        ],
        "bestfor": "All Participants Welcome",
        "save": false
    },
    {
        "uniqueId": "5/11/2025 22:45:04",
        "display_date": "Aug 7",
        "date": "8/7/2025",
        "display_time": "9:00 - 12:00 pm",
        "sessiontime": "9:00:00 AM",
        "datetime": "2025-08-07T13:00:00.000Z",
        "militarytime": "09:00",
        "sessionteacher(s)": "Lindsay Noll, Stephanie Hafner, Tiffany Hutchins",
        "sessiontitle": "iPad Accessibility",
        "zoomLink": "n/a",
        "location": "Horizon ",
        "roomnumber": "IDC",
        "sessiondescription": "Come learn about different iPad features and ways to support all learners in your class. ",
        "sessioncategory": [
            "Personalization",
            "Student Needs (EL/Gifted/Special Education)",
            "Lesson Design"
        ],
        "bestfor": "All Participants Welcome, Grades PreK-5",
        "save": false
    },
    {
        "uniqueId": "5/12/2025 11:08:20",
        "display_date": "Aug 7",
        "date": "8/7/2025",
        "display_time": "9:00 - 11:00 am",
        "sessiontime": "9:00:00 AM",
        "datetime": "2025-08-07T13:00:00.000Z",
        "militarytime": "09:00",
        "sessionteacher(s)": "Nikole Abate",
        "sessiontitle": "Reading Fluency Tune-Up",
        "zoomLink": "n/a",
        "location": "Memorial",
        "roomnumber": "Media Center",
        "sessiondescription": "Now that we've gotten reading fluency groups going in our secondary classrooms, it's time to tune up our skills! Join this session for a refresher, some additional fluency instructional practices, and examination of curriculum guides in order to embed more fluency work into our school year.",
        "sessioncategory": [
            "Instructional Framework",
            "Lesson Design"
        ],
        "bestfor": "Grades 6-12",
        "save": false
    },
    {
        "uniqueId": "5/7/2025 12:02:57",
        "display_date": "Aug 8",
        "date": "8/8/2025",
        "display_time": "8:00 - 11:00 am",
        "sessiontime": "8:00:00 AM",
        "datetime": "2025-08-08T12:00:00.000Z",
        "militarytime": "08:00",
        "sessionteacher(s)": "Maria Stead",
        "sessiontitle": "Unpacking your Canvas Course",
        "zoomLink": "n/a",
        "location": "Darby ",
        "roomnumber": "Media Center",
        "sessiondescription": "Use this time to unpack and clean up your Canvas courses for the new school year, create new content, and learn about new features! Consider coming with your data team to plan/create content together!",
        "sessioncategory": [
            "Systems Management (eSchool/Canvas/TAC)"
        ],
        "bestfor": "Grades 6-12",
        "save": false
    },
    {
        "uniqueId": "5/15/2025 22:11:12",
        "display_date": " Aug 8",
        "date": "8/8/2025",
        "display_time": "8:00 - 12:00 pm",
        "sessiontime": "8:00:00 AM",
        "datetime": "2025-08-08T12:00:00.000Z",
        "militarytime": "08:00",
        "sessionteacher(s)": "Mindy Mordarski, Jon Way",
        "sessiontitle": "Memorial Middle School Department Faciltiator Retreat",
        "zoomLink": "n/a",
        "location": "Memorial",
        "roomnumber": "TBD",
        "sessiondescription": "The leadership team at MMS will work to create school year plan for professional development.",
        "sessioncategory": [
            "Assessment & Data",
            "Culture / Leadership",
            "Instructional Framework"
        ],
        "bestfor": "Grades 6-8",
        "save": false
    },
    {
        "uniqueId": "5/12/2025 10:53:52",
        "display_date": "Aug 8",
        "date": "8/8/2025",
        "display_time": "9:00 - 11:00 am",
        "sessiontime": "9:00:00 AM",
        "datetime": "2025-08-08T13:00:00.000Z",
        "militarytime": "09:00",
        "sessionteacher(s)": "Nikole Abate",
        "sessiontitle": "ELA State Test Item Analysis & Instructional Implications",
        "zoomLink": "n/a",
        "location": "Memorial",
        "roomnumber": "Media Center",
        "sessiondescription": "In this session, we will engage in item analysis of the 2024-25 ELA state test results and explore the instructional implications of the analysis.",
        "sessioncategory": [
            "Assessment & Data",
            "Instructional Framework"
        ],
        "bestfor": "Grades 6-12",
        "save": false
    },
    {
        "uniqueId": "5/7/2025 12:05:58",
        "display_date": "Aug 8",
        "date": "8/8/2025",
        "display_time": "11:30 - 2:30 pm",
        "sessiontime": "11:30:00 AM",
        "datetime": "2025-08-08T15:30:00.000Z",
        "militarytime": "11:30",
        "sessionteacher(s)": "Maria Stead",
        "sessiontitle": "ChatGPT and Beyond: AI Tools to Supercharge Your Plans",
        "zoomLink": "n/a",
        "location": "Darby ",
        "roomnumber": "Media Center",
        "sessiondescription": "Discover how AI tools like ChatGPT can streamline your planning and spark creativity in your 6–12 classroom. This session will show you how to craft effective prompts, generate lesson ideas, adapt content for diverse learners, and save time on routine tasks. No tech expertise required—just bring your curiosity and leave with ready-to-use strategies and resources to supercharge your planning with AI.",
        "sessioncategory": [
            "Personalization",
            "Lesson Design"
        ],
        "bestfor": "All Participants Welcome",
        "save": false
    },
    {
        "uniqueId": "5/11/2025 22:48:12",
        "display_date": "Aug 8",
        "date": "8/8/2025",
        "display_time": "12:00 - 3:00 pm",
        "sessiontime": "12:00:00 PM",
        "datetime": "2025-08-08T16:00:00.000Z",
        "militarytime": "12:00",
        "sessionteacher(s)": "Tiffany Hutchins, Stephanie Hafner, Lindsay Noll",
        "sessiontitle": "iPad Accessibility",
        "zoomLink": "n/a",
        "location": "Horizon",
        "roomnumber": "IDC",
        "sessiondescription": "Come learn about different iPad features and ways to support all learners in your class.",
        "sessioncategory": [
            "Personalization",
            "Student Needs (EL/Gifted/Special Education)",
            "Lesson Design"
        ],
        "bestfor": "All Participants Welcome, Grades PreK-5",
        "save": false
    },
    {
        "uniqueId": "5/6/2025 8:22:24",
        "display_date": "Aug 11 & 12",
        "date": "8/11/2025",
        "display_time": "7:30 - 1:30, 7:30 - 12:30",
        "sessiontime": "7:30:00 AM",
        "datetime": "2025-08-11T11:30:00.000Z",
        "militarytime": "07:30",
        "sessionteacher(s)": "Jennifer Cooper, Kristen Clausen",
        "sessiontitle": "Freshmen Focus Camp",
        "zoomLink": "n/a",
        "location": "Davidson",
        "roomnumber": "PAC",
        "sessiondescription": "For Davidson Focus Teacher Only-meet and team build with your incoming freshmen at Focus Camp. Also, there will be time for in person team planning for the year. ",
        "sessioncategory": [
            "Student Engagement"
        ],
        "bestfor": "Grades 9-12",
        "save": false
    },
    {
        "uniqueId": "5/8/2025 10:00:11",
        "display_date": "Aug 11",
        "date": "8/11/2025",
        "display_time": "8:00 - 2:00 pm",
        "sessiontime": "8:00:00 AM",
        "datetime": "2025-08-11T12:00:00.000Z",
        "militarytime": "08:00",
        "sessionteacher(s)": "Whitney Weadock ",
        "sessiontitle": "Darby Creek 3rd Grade Wit & Wisdom Technology Implementation  ",
        "zoomLink": "n/a",
        "location": "DCR",
        "roomnumber": "IDC",
        "sessiondescription": "3rd grade will work to learn about new powerful ways to use technology with our wit and wisdom curriculum. Using our ipad and new tools we will create hands on engaging kick off lessons and plans for students all year long.  ",
        "sessioncategory": [
            "Assessment & Data",
            "Instructional Framework",
            "Personalization",
            "Lesson Design"
        ],
        "bestfor": "Grades 3-5",
        "save": false
    },
    {
        "uniqueId": "5/9/2025 9:03:38",
        "display_date": "Aug 11",
        "date": "8/11/2025",
        "display_time": "8:00 - 11:00 am",
        "sessiontime": "8:00:00 AM",
        "datetime": "2025-08-11T12:00:00.000Z",
        "militarytime": "08:00",
        "sessionteacher(s)": "Ashley Lambacher, Eric Gingerich",
        "sessiontitle": "Canvas Refresh",
        "zoomLink": "n/a",
        "location": "Memorial",
        "roomnumber": "Media Center - 142",
        "sessiondescription": "Ready to start fresh? Let's streamline and organize your Canvas courses for a smoother, more effective teaching experience. Import and remove content, tidy up your digital space, and ensure your course is accessible and student-friendly. Whether you're prepping for a new year or starting fresh, this session will help you get your Canvas space in top shape.",
        "sessioncategory": [
            "Systems Management (eSchool/Canvas/TAC)"
        ],
        "bestfor": "Grades 6-8",
        "save": false
    },
    {
        "uniqueId": "5/12/2025 11:31:06",
        "display_date": "Aug 11",
        "date": "8/11/2025",
        "display_time": "8:00 - 3:00 pm",
        "sessiontime": "8:00:00 AM",
        "datetime": "2025-08-11T12:00:00.000Z",
        "militarytime": "08:00",
        "sessionteacher(s)": "Patricia Howard, Jennifer Lowery",
        "sessiontitle": "Gifted: Leveraging State Test Results to Inform Future Instruction (Gifted Competencies a, b, c, f, g)",
        "zoomLink": "n/a",
        "location": "Darby",
        "roomnumber": "Media Center",
        "sessiondescription": "Come deep dive into released state test questions and breakdown results from the Spring 2025 state test for your content!  We will be celebrating strengths, reflecting on concerns and relating questions to our updates in curriculum.",
        "sessioncategory": [
            "Assessment & Data",
            "Instructional Framework",
            "Lesson Design"
        ],
        "bestfor": "Grades 6-12",
        "save": false
    },
    {
        "uniqueId": "5/15/2025 22:07:35",
        "display_date": "Aug 11",
        "date": "8/11/2025",
        "display_time": "8:00 - 3:00 pm",
        "sessiontime": "8:00:00 AM",
        "datetime": "2025-08-11T12:00:00.000Z",
        "militarytime": "08:00",
        "sessionteacher(s)": "Mindy Mordarski, Jon Way",
        "sessiontitle": "Memorial MS Staff Retreat",
        "zoomLink": "n/a",
        "location": "TBD",
        "roomnumber": "TBD",
        "sessiondescription": "This will be a time for the MMS staff to reconnect and plan for how we will continue to work toward our district and building goals.",
        "sessioncategory": [
            "Assessment & Data",
            "Culture / Leadership",
            "Instructional Framework",
            "Lesson Design"
        ],
        "bestfor": "Grades 6-8",
        "save": false
    },
    {
        "uniqueId": "5/14/2025 9:28:52",
        "display_date": "Aug 11",
        "date": "8/11/2025",
        "display_time": "8:15 - 2:15 pm",
        "sessiontime": "8:15:00 AM",
        "datetime": "2025-08-11T12:15:00.000Z",
        "militarytime": "08:15",
        "sessionteacher(s)": "Katherine Hueter",
        "sessiontitle": "WMS Staff Retreat",
        "zoomLink": "n/a",
        "location": "WMS / Off-Site Location",
        "roomnumber": "WMS / Off-Site Location",
        "sessiondescription": "WMS Staff Retreat will focus around team - building, reflection, and growth for the 25-26 school year!",
        "sessioncategory": [
            "WMS Staff Retreat"
        ],
        "bestfor": "Weaver Staff",
        "save": false
    },
    {
        "uniqueId": "4/25/2025 12:10:13",
        "display_date": "Aug 11",
        "date": "8/11/2025",
        "display_time": "9:00 - 12:00 pm",
        "sessiontime": "9:00:00 AM",
        "datetime": "2025-08-11T13:00:00.000Z",
        "militarytime": "09:00",
        "sessionteacher(s)": "Tabatha Stover, Carrie Higginbotham, Susan Cook",
        "sessiontitle": "Bringing Wit & Wisdom to Life: Integrating Books, Videos, Technology, and STEAM in the Elementary Classroom",
        "zoomLink": "n/a",
        "location": "SDE",
        "roomnumber": "IDC",
        "sessiondescription": "In this hands-on session, elementary educators will explore creative and practical ways to enhance the Wit & Wisdom literacy program by integrating supplemental books, visual media, technology tools, and STEAM-based activities. Participants will learn how to align additional resources with module themes to support deeper comprehension, student engagement, and cross-curricular connections. Educators will leave with ready-to-use ideas, curated resource lists, and strategies to make learning more inclusive, interactive, and inspiring for all students.",
        "sessioncategory": [
            "Instructional Framework"
        ],
        "bestfor": "Grades PreK-5",
        "save": false
    },
    {
        "uniqueId": "5/9/2025 14:50:35",
        "display_date": "Aug 11",
        "date": "8/11/2025",
        "display_time": "9:00 - 3:00 pm",
        "sessiontime": "9:00:00 AM",
        "datetime": "2025-08-11T13:00:00.000Z",
        "militarytime": "09:00",
        "sessionteacher(s)": "Hilary Mako",
        "sessiontitle": "Occupational Therapy CEUs",
        "zoomLink": "n/a",
        "location": "CO",
        "roomnumber": "n/a",
        "sessiondescription": "Occupational therapists will explore CEU courses to obtain information on current, best practices in the school and pediatric settings.",
        "sessioncategory": [
            "Student Needs (EL/Gifted/Special Education)"
        ],
        "bestfor": "Related Services",
        "save": false
    },
    {
        "uniqueId": "5/13/2025 11:28:01",
        "display_date": "Aug 11",
        "date": "8/11/2025",
        "display_time": "12:00 - 3:00 pm",
        "sessiontime": "12:00:00 PM",
        "datetime": "2025-08-11T16:00:00.000Z",
        "militarytime": "12:00",
        "sessionteacher(s)": "Molly Walker",
        "sessiontitle": "Preparing  Your Intervention Plans for the School Year",
        "zoomLink": "n/a",
        "location": "Central Office",
        "roomnumber": "Jaguar Room",
        "sessiondescription": "We will examine best practices in intervention tracking and set up the shell for your intervention plans in Performance Matters so you are ready to go to start the school year!",
        "sessioncategory": [
            "Intervention"
        ],
        "bestfor": "Grades PreK-5, Grades 6-8, Grades 9-12",
        "save": false
    },
    {
        "uniqueId": "5/6/2025 15:00:25",
        "display_date": "Aug 12",
        "date": "8/12/2025",
        "display_time": "8:00 - 2:00 pm",
        "sessiontime": "8:00:00 AM",
        "datetime": "2025-08-12T12:00:00.000Z",
        "militarytime": "08:00",
        "sessionteacher(s)": "Whitney Weadock",
        "sessiontitle": "DCR 4th grade Wit & Wisdom Technology PD",
        "zoomLink": "n/a",
        "location": "Darby Creek",
        "roomnumber": "IDC",
        "sessiondescription": "Come dig into our Technology and Wit & Wisdom connection. How can we more purposefully integrate technology into our daily wit and wisdom lesson to remove the extra load of workbooks & paper copies. In this session teachers will walk away with lessons and plans they can instantly begin with their class. ",
        "sessioncategory": [
            "Assessment & Data",
            "Instructional Framework",
            "Personalization",
            "Lesson Design"
        ],
        "bestfor": "Grades 3-5",
        "save": false
    },
    {
        "uniqueId": "5/7/2025 11:40:10",
        "display_date": "Aug 12",
        "date": "8/12/2025",
        "display_time": "8:00 - 2:00 pm",
        "sessiontime": "8:00:00 AM",
        "datetime": "2025-08-12T12:00:00.000Z",
        "militarytime": "08:00",
        "sessionteacher(s)": "Michael Bleh",
        "sessiontitle": "Gifted: Advanced Placement Social Studies Pedagogy (Gifted Competencies a,b,c,f,g)",
        "zoomLink": "n/a",
        "location": "Darby ",
        "roomnumber": "223",
        "sessiondescription": "This session will focus on the latest research from College Board on identifying\ninstructional strategies and tools such as PBL (Project Based Learning) to teach AP Social Studies courses.  Participants will also have a crash course on the latest assessment and review tools in the AP Classroom Platform.  ",
        "sessioncategory": [
            "Instructional Framework"
        ],
        "bestfor": "Grades 9-12, AP Social Studies Teachers",
        "save": false
    },
    {
        "uniqueId": "5/12/2025 11:42:03",
        "display_date": "Aug 12",
        "date": "8/12/2025",
        "display_time": "8:00 - 3:00 pm",
        "sessiontime": "8:00:00 AM",
        "datetime": "2025-08-12T12:00:00.000Z",
        "militarytime": "08:00",
        "sessionteacher(s)": "Patricia Howard, Jennifer Lowery",
        "sessiontitle": "Gifted: Sharing Curriculum Updates & Creative Lesson Design (Gifted Competencies a, b, c, f, g)",
        "zoomLink": "n/a",
        "location": "Bradley",
        "roomnumber": "Media Center",
        "sessiondescription": "Come take a look at the work your peers have done around updates to our IM curriculum!  We will be spending time designing ways to intentionally integrate opportunities for BTC tasks and other creative lesson designs within the provided curriculum.",
        "sessioncategory": [
            "Assessment & Data",
            "Instructional Framework",
            "Lesson Design"
        ],
        "bestfor": "Grades 6-12",
        "save": false
    },
    {
        "uniqueId": "5/11/2025 8:45:49",
        "display_date": "Aug 12",
        "date": "8/12/2025",
        "display_time": "8:30 - 3:30 pm",
        "sessiontime": "8:30:00 AM",
        "datetime": "2025-08-12T12:30:00.000Z",
        "militarytime": "08:30",
        "sessionteacher(s)": "Livi Constantinovich",
        "sessiontitle": "Darby Creek Retreat",
        "zoomLink": "n/a",
        "location": "Darby Creek",
        "roomnumber": "IDC",
        "sessiondescription": "Darby Creek staff will be gathering for a fun day of team building, SEL, and continued work with PBIS. This will provide positive momentum as we kick off the school year together!",
        "sessioncategory": [
            "Social Emotional Learning",
            "Staff Wellness",
            "Student Well-Being"
        ],
        "bestfor": "All Participants Welcome",
        "save": false
    },
    {
        "uniqueId": "5/12/2025 16:15:06",
        "display_date": "Aug 12",
        "date": "8/12/2025",
        "display_time": "8:30 - 3:30 pm",
        "sessiontime": "8:30:00 AM",
        "datetime": "2025-08-12T12:30:00.000Z",
        "militarytime": "08:30",
        "sessionteacher(s)": "Paige Canale",
        "sessiontitle": "Alton Darby Staff Retreat",
        "zoomLink": "n/a",
        "location": "Alton Darby",
        "roomnumber": "IDC",
        "sessiondescription": "Alton Darby staff please join me for our staff retreat! This will be a time to connect, converse, and collaborate with one another to prepare for the 2025-26 school year.  ",
        "sessioncategory": [
            "Social Emotional Learning",
            "Staff Wellness",
            "Student Well-Being",
            "Lesson Design"
        ],
        "bestfor": "Alton Darby Staff",
        "save": false
    },
    {
        "uniqueId": "5/16/2025 8:37:08",
        "display_date": "Aug 12",
        "date": "8/12/2025",
        "display_time": "8:30 - 3:00 pm",
        "sessiontime": "8:30:00 AM",
        "datetime": "2025-08-12T12:30:00.000Z",
        "militarytime": "08:30",
        "sessionteacher(s)": "Amy Ebenezer, Colleen Baker",
        "sessiontitle": "Physical Science Curriculum Reimagined",
        "zoomLink": "n/a",
        "location": "Bradley",
        "roomnumber": "SC140",
        "sessiondescription": "Physical science teachers will explore the updated curriculum. They will learn about the whys and hows of the lessons and will participate in some of the engage and explore activities in their units. ",
        "sessioncategory": [
            "Student Engagement",
            "Lesson Design"
        ],
        "bestfor": "Grades 9-12",
        "save": false
    },
    {
        "uniqueId": "5/3/2025 6:48:55",
        "display_date": "Aug 12",
        "date": "8/12/2025",
        "display_time": "9:00 - 3:30 pm",
        "sessiontime": "9:00:00 AM",
        "datetime": "2025-08-12T13:00:00.000Z",
        "militarytime": "09:00",
        "sessionteacher(s)": "Kayla Pinnick",
        "sessiontitle": "Hilliard Crossing Staff Retreat",
        "zoomLink": "n/a",
        "location": "Hilliard Crossing",
        "roomnumber": "IDC",
        "sessiondescription": "Hilliard Crossing Staff Retreat - We will focus on examining student data for the upcoming year and delve into our SEL and PBIS practices",
        "sessioncategory": [
            "Assessment & Data",
            "Personalization"
        ],
        "bestfor": "All Participants Welcome",
        "save": false
    },
    {
        "uniqueId": "5/6/2025 11:32:37",
        "display_date": "Aug 13",
        "date": "8/12/2025",
        "display_time": "9:00 - 3:00 pm",
        "sessiontime": "9:00:00 AM",
        "datetime": "2025-08-12T13:00:00.000Z",
        "militarytime": "09:00",
        "sessionteacher(s)": "Yvonne Haight, Heather Conrad",
        "sessiontitle": "Motor Team Retreat",
        "zoomLink": "n/a",
        "location": "Central Office/off site",
        "roomnumber": "Flex Space",
        "sessiondescription": "Join us for visual and hearing simulation and preparation for the 25-26 school year, including team building.",
        "sessioncategory": [
            "Student Needs (EL/Gifted/Special Education)"
        ],
        "bestfor": "Related Services",
        "save": false
    },
    {
        "uniqueId": "5/7/2025 7:42:52",
        "display_date": "Aug 12",
        "date": "8/12/2025",
        "display_time": "9:00 - 3:30 pm",
        "sessiontime": "9:00:00 AM",
        "datetime": "2025-08-12T13:00:00.000Z",
        "militarytime": "09:00",
        "sessionteacher(s)": "2025 JWR Staff Retreat",
        "sessiontitle": "2025 JWR Staff Retreat",
        "zoomLink": "n/a",
        "location": "JWR ",
        "roomnumber": "IDC, Cafeteria, and Gym",
        "sessiondescription": "Come join our 2025 JWR staff retreat to meet new staff, begin staff Culture Camp, and get ready for the 2025-26 academic year as a building learning community",
        "sessioncategory": [
            "Culture / Leadership",
            "Diversity & Equity",
            "Social Emotional Learning"
        ],
        "bestfor": "Counselors, EL, Gifted, Grades PreK-5, Related Services, Special Education",
        "save": false
    },
    {
        "uniqueId": "5/7/2025 12:03:38",
        "display_date": "Aug 12",
        "date": "8/12/2025",
        "display_time": "9:00 - 3:00 pm",
        "sessiontime": "9:00:00 AM",
        "datetime": "2025-08-12T13:00:00.000Z",
        "militarytime": "09:00",
        "sessionteacher(s)": "Whitney Jeckavitch, Kristina Bope",
        "sessiontitle": "BNLC Staff Retreat",
        "zoomLink": "n/a",
        "location": "Britton and Norwich",
        "roomnumber": "Gym/IDC",
        "sessiondescription": "We will do team building in the morning and \"pick your own PD\" in the afternoon where staff will choose from courses offered by building experts.",
        "sessioncategory": [
            "Instructional Framework,"
        ],
        "bestfor": "All Participants Welcome",
        "save": false
    },
    {
        "uniqueId": "5/9/2025 20:08:47",
        "display_date": "Aug 12",
        "date": "8/12/2025",
        "display_time": "9:00 - 3:00 pm",
        "sessiontime": "9:00:00 AM",
        "datetime": "2025-08-12T13:00:00.000Z",
        "militarytime": "09:00",
        "sessionteacher(s)": "Lauren Barkdull",
        "sessiontitle": "Horizon Staff Retreat",
        "zoomLink": "n/a",
        "location": "Horizon",
        "roomnumber": "IDC",
        "sessiondescription": "Horizon Staff Retreat",
        "sessioncategory": [
            "Staff Wellness"
        ],
        "bestfor": "All Participants Welcome",
        "save": false
    },
    {
        "uniqueId": "5/12/2025 9:52:19",
        "display_date": "Aug 12",
        "date": "8/12/2025",
        "display_time": "9:00 - 3:00 pm",
        "sessiontime": "9:00:00 AM",
        "datetime": "2025-08-12T13:00:00.000Z",
        "militarytime": "09:00",
        "sessionteacher(s)": "Kevin Landon, Michael Heitzman",
        "sessiontitle": "Avery Summer Retreaty",
        "zoomLink": "n/a",
        "location": "Avery Elementary",
        "roomnumber": "Avery Gymnasium",
        "sessiondescription": "Introduction of new staff-What did you do this summer-personal and team goals for the year-building upgrades/changes-discipline support-data dive-team building.",
        "sessioncategory": [
            "Assessment & Data",
            "Instructional Framework",
            "Staff Wellness",
            "Student Engagement"
        ],
        "bestfor": "Grades PreK-5",
        "save": false
    },
    {
        "uniqueId": "5/12/2025 10:00:19",
        "display_date": "Aug 12",
        "date": "8/12/2025",
        "display_time": "9:00 - 3:00 pm",
        "sessiontime": "9:00:00 AM",
        "datetime": "2025-08-12T13:00:00.000Z",
        "militarytime": "09:00",
        "sessionteacher(s)": "Kristina Bope, Whitney Jeckavitch",
        "sessiontitle": "BNLC Staff Retreat",
        "zoomLink": "n/a",
        "location": "Britton Norwich Learning Campus",
        "roomnumber": "IDC",
        "sessiondescription": "Staff will participate in team building activities in the morning and spend the afternoon choosing from PD session of their choice lead by building staff. ",
        "sessioncategory": [
            "Instructional Framework"
        ],
        "bestfor": "PreK-2",
        "save": false
    },
    {
        "uniqueId": "5/7/2025 20:50:54",
        "display_date": "Aug 12",
        "date": "8/12/2025",
        "display_time": "10:00 - 4:00 pm",
        "sessiontime": "10:00:00 AM",
        "datetime": "2025-08-12T14:00:00.000Z",
        "militarytime": "10:00",
        "sessionteacher(s)": "Monica Woodson, SIT Team",
        "sessiontitle": "Washington Staff Retreat",
        "zoomLink": "n/a",
        "location": "Washington ",
        "roomnumber": "n/a",
        "sessiondescription": "A chance to reconnect with colleagues, meet new staff members, and enjoy some fun activities—plus a bit of planning for the upcoming school year.",
        "sessioncategory": [
            "Staff Wellness"
        ],
        "bestfor": "Washington Staff",
        "save": false
    },
    {
        "uniqueId": "5/9/2025 9:05:19",
        "display_date": "Aug 12",
        "date": "8/12/2025",
        "display_time": "12:00 - 3:00 pm",
        "sessiontime": "12:00:00 PM",
        "datetime": "2025-08-12T16:00:00.000Z",
        "militarytime": "12:00",
        "sessionteacher(s)": "Ashley Lambacher, Eric Gingerich",
        "sessiontitle": "Canvas Refresh",
        "zoomLink": "n/a",
        "location": "Memorial",
        "roomnumber": "Media Center - 142",
        "sessiondescription": "Ready to start fresh? Let's streamline and organize your Canvas courses for a smoother, more effective teaching experience. Import and remove content, tidy up your digital space, and ensure your course is accessible and student-friendly. Whether you're prepping for a new year or starting fresh, this session will help you get your Canvas space in top shape.",
        "sessioncategory": [
            "Systems Management (eSchool/Canvas/TAC)"
        ],
        "bestfor": "Grades 6-8",
        "save": false
    },
    {
        "uniqueId": "5/9/2025 14:16:20",
        "display_date": "Aug 13",
        "date": "8/13/2025",
        "display_time": "8:00 - 3:00 pm",
        "sessiontime": "8:00:00 AM",
        "datetime": "2025-08-13T12:00:00.000Z",
        "militarytime": "08:00",
        "sessionteacher(s)": "Kevin Buchman, Kim Rowland",
        "sessiontitle": "Ridgewood Rally 2025 - Staff Only",
        "zoomLink": "n/a",
        "location": "RGW",
        "roomnumber": "IDC and Cafeteria",
        "sessiondescription": "\"We over Me\" Activities for Staff",
        "sessioncategory": [
            "Culture / Leadership",
            "Diversity & Equity",
            "Social Emotional Learning",
            "Staff Wellness",
            "Student Well-Being"
        ],
        "bestfor": "Grades PreK-5",
        "save": false
    },
    {
        "uniqueId": "5/12/2025 11:49:30",
        "display_date": "Aug 13",
        "date": "8/13/2025",
        "display_time": "8:00 - 3:00 pm",
        "sessiontime": "8:00:00 AM",
        "datetime": "2025-08-13T12:00:00.000Z",
        "militarytime": "08:00",
        "sessionteacher(s)": "Stacy Carter, Craig Vroom",
        "sessiontitle": "Innovation Campus Staff Retreat",
        "zoomLink": "n/a",
        "location": "The Hub",
        "roomnumber": "Union",
        "sessiondescription": "This is the staff retreat for the Innovation Campus",
        "sessioncategory": [
            "Culture / Leadership",
            "Staff Wellness"
        ],
        "bestfor": "Innovation Campus Staff",
        "save": false
    },
    {
        "uniqueId": "5/11/2025 19:08:20",
        "display_date": "Aug 13",
        "date": "8/13/2025",
        "display_time": "8:30 - 3:30 pm",
        "sessiontime": "8:30:00 AM",
        "datetime": "2025-08-13T12:30:00.000Z",
        "militarytime": "08:30",
        "sessionteacher(s)": "Holly Meister, Liz McClellan",
        "sessiontitle": "SDE Staff Retreat",
        "zoomLink": "n/a",
        "location": "Scioto Darby ES",
        "roomnumber": "Staff Lounge",
        "sessiondescription": "Staff will collaborate on topics around building PBIS and staff wellness",
        "sessioncategory": [
            "Social Emotional Learning",
            "Staff Wellness",
